1;Hiérarchie;Description de la hiérarchie;1
3;Anatomie;Description de l'anatomie;1
4;Habitat;Description de l'habitat;1
5;Pourquoi hurle t-il ??;Description sur les hurlements;2
6;Que mange t-il ??;Description sur la nourriture;2
7;Légendes & Mythes;Description des légendes et mythes;3
8;Les vikings & les loups;Description sur les vikings et les loups;4
9;Préhistoire;Description de la préhistoire;5
10;Découverte scientifique sur les loups;Description des découvertes scientifiques;6
11;Films & reportages;Description des films et reportages;7
12;Livres & contines;Description des livres et contines;7
13;Chiens qui ressemblent au loup;Description des chiens ressemblant au loup;7
14;Le loup & la France;Description du loup en France;8
15;Pays protecteurs;Description des pays protecteurs;9
16;Interprétations des rêves de loups;Réaliser un rêve de loup révèle une dimension hostile et mystérieuse de votre personnalité, ainsi que vos instincts sauvages que vous avez du mal à contrôler. Les rêves de loup peuvent témoigner de la nature brutale et cruelle de votre personnalité et indiquer le commencement d'une situation difficile dans votre existence;11
17;Faits amusants sur les loups;Description des faits amusants;11
18;Actualités;Description des actualités;11




